{
  "trace_id": "tr-valid-refund-001",
  "task_type": "customer_refund",
  "processed_at": "2026-09-29T06:18:38.339447Z",
  "risk_score": 16.75,
  "risk_tier": "LOW",
  "scope_findings": [],
  "pii_findings": [
    {
      "finding_id": "pii-5a42cf89",
      "step_index": 2,
      "field_path": "steps[2].output.customer_email",
      "field_name": "steps[2].output.customer_email",
      "pii_type": "EMAIL",
      "entity_type": "EMAIL",
      "severity": "LOW",
      "redacted_snippet": "[REDACTED_EMAIL]",
      "snippet_redacted": "[REDACTED_EMAIL]",
      "detection_method": "regex",
      "context": "internal_tool_output",
      "confidence_score": 0.98,
      "engine": "heuristic:regex-pattern-fallback"
    }
  ],
  "groundedness_findings": [
    {
      "finding_id": "gr-66184554",
      "claim": "Your refund of $120.00 for order ORD-1001 was processed successfully.",
      "statement": "Your refund of $120.00 for order ORD-1001 was processed successfully.",
      "evidence_snippet": "order id is ORD-1001.",
      "evidence_context": "order id is ORD-1001.",
      "evidence_step_index": 2,
      "tool_name": "order_lookup",
      "similarity": 0.6258,
      "similarity_score": 0.6258,
      "nli_verdict": "CONTRADICTION",
      "audit_verdict": "CONTRADICTED",
      "is_grounded": false,
      "severity": "CRITICAL",
      "engine": "heuristic:semantic-rule-engine-v1"
    },
    {
      "finding_id": "gr-07a718fd",
      "claim": "Transaction ID: synth-tx-77a8b99c01.",
      "statement": "Transaction ID: synth-tx-77a8b99c01.",
      "evidence_snippet": "transaction id is synth-tx-77a8b99c01.",
      "evidence_context": "transaction id is synth-tx-77a8b99c01.",
      "evidence_step_index": 5,
      "tool_name": "refund_tool",
      "similarity": 0.9749,
      "similarity_score": 0.9749,
      "nli_verdict": "ENTAILMENT",
      "audit_verdict": "SUPPORTED",
      "is_grounded": true,
      "severity": "LOW",
      "engine": "heuristic:semantic-rule-engine-v1"
    }
  ],
  "counts": {
    "total_steps": 7,
    "tool_calls": 2,
    "tool_results": 2,
    "errors": 0,
    "scope_violations": 0,
    "pii_entities_detected": 1,
    "unsupported_claims": 1
  },
  "summary": "Trace was flagged LOW because it contained one sensitive data disclosure (EMAIL) and one contradicted final-answer claim.",
  "raw_trace_storage_pointer": {
    "s3_bucket": "ai-agent-audit-traces-local",
    "s3_key": "traces/tr-valid-refund-001.json",
    "s3_uri": "s3://ai-agent-audit-traces-local/traces/tr-valid-refund-001.json"
  },
  "risk_result": {
    "scope_score": 0.0,
    "pii_score": 5.0,
    "groundedness_score": 50.0,
    "overall_score": 16.75,
    "risk_tier": "LOW"
  },
  "engine_info": {
    "nli_engine": "heuristic:semantic-rule-engine-v1",
    "embedding_engine": "sentence-transformers/all-MiniLM-L6-v2",
    "pii_engine": "heuristic:regex-pattern-fallback",
    "is_degraded": true,
    "degraded_reasons": [
      "Heuristic engine requested by configuration",
      "Presidio NLP model ('en_core_web_sm') unavailable; using regex pattern fallback"
    ]
  },
  "is_degraded": true,
  "degraded_reasons": [
    "Heuristic engine requested by configuration",
    "Presidio NLP model ('en_core_web_sm') unavailable; using regex pattern fallback"
  ],
  "status": "DEGRADED"
}